<module xmlns:xsi="http://www.w3.org/2001/XMLSchema-instance"
        xsi:noNamespaceSchemaLocation="../desc.xsd" id="mds_cups">
    <name>Printing service</name>
    <desc>Network printers management</desc>
    <actions>
        <action type="link" name="Printers management" value="http://@HOSTNAME@:631/admin/" />
    </actions>
    <packages>
        <target name="all">
            <rpm>cups</rpm>
            <rpm>cups-drivers</rpm>
            <rpm>cups-windows</rpm>
            <rpm>foomatic-filters</rpm>
            <rpm>hplip-hpijs-ppds</rpm>
            <rpm>postscript-ppds</rpm>
            <rpm>hplip</rpm>
        </target>
    </packages>
    <config>
        <check name="fw_lan" default="on">
            <label>Allow connections to the management interface from internal networks</label>
            <help>Configure the firewall to accept connections on the Cups
                interface from interfaces configured as 'internal'</help>
        </check>
        <check name="fw_wan" default="off">
            <label>Allow connections to the management interface from external networks</label>
            <help>Configure the firewall to accept connections on the Cups
                interface from interfaces configured as 'external'</help>
        </check>
    </config>
    <text>The printing service is running.</text>
    <text>You can add new printers from the Cups web interface : https://@HOSTNAME@:631/admin/</text>
    <text>Login to the Cups interface is the root account.</text>
</module>
